tweet_id,in_reply_to_status_id,in_reply_to_user_id,timestamp,source,text,retweeted_status_id,retweeted_status_user_id,retweeted_status_timestamp,expanded_urls,rating_numerator,rating_denominator,name,dog_nick,favorite_count,retweet_count,media_type,dog_breed,dog_breed_conf
892420643555336193,nan,nan,2017-08-01 16:23:56,"<a href=""http://twitter.com/download/iphone"" rel=""nofollow"">Twitter for iPhone</a>",This is Phineas. He's a mystical boy. Only ever appears in the hole of a donut. 13/10 https://t.co/MgUWQ76dJU,nan,nan,,https://twitter.com/dog_rates/status/892420643555336193/photo/1,13,10,Phineas,,,,,,
892177421306343426,nan,nan,2017-08-01 00:17:27,"<a href=""http://twitter.com/download/iphone"" rel=""nofollow"">Twitter for iPhone</a>","This is Tilly. She's just checking pup on you. Hopes you're doing ok. If not, she's available for pats, snugs, boops, the whole bit. 13/10 https://t.co/0Xxu71qeIV",nan,nan,,https://twitter.com/dog_rates/status/892177421306343426/photo/1,13,10,Tilly,,33263,6319,photo,chihuahua,0.323581
891815181378084864,nan,nan,2017-07-31 00:18:03,"<a href=""http://twitter.com/download/iphone"" rel=""nofollow"">Twitter for iPhone</a>",This is Archie. He is a rare Norwegian Pouncing Corgo. Lives in the tall grass. You never know when one may strike. 12/10 https://t.co/wUnZnhtVJB,nan,nan,,https://twitter.com/dog_rates/status/891815181378084864/photo/1,12,10,Archie,,25062,4193,photo,chihuahua,0.716012
891689557279858688,nan,nan,2017-07-30 15:58:51,"<a href=""http://twitter.com/download/iphone"" rel=""nofollow"">Twitter for iPhone</a>",This is Darla. She commenced a snooze mid meal. 13/10 happens to the best of us https://t.co/tD36da7qLQ,nan,nan,,https://twitter.com/dog_rates/status/891689557279858688/photo/1,13,10,Darla,,42213,8713,photo,,
891327558926688256,nan,nan,2017-07-29 16:00:24,"<a href=""http://twitter.com/download/iphone"" rel=""nofollow"">Twitter for iPhone</a>","This is Franklin. He would like you to stop calling him ""cute."" He is a very fierce shark and should be respected as such. 12/10 #BarkWeek https://t.co/AtUZn91f7f",nan,nan,,"https://twitter.com/dog_rates/status/891327558926688256/photo/1,https://twitter.com/dog_rates/status/891327558926688256/photo/1",12,10,Franklin,,40359,9485,photo,basset,0.555712
891087950875897856,nan,nan,2017-07-29 00:08:17,"<a href=""http://twitter.com/download/iphone"" rel=""nofollow"">Twitter for iPhone</a>",Here we have a majestic great white breaching off South Africa's coast. Absolutely h*ckin breathtaking. 13/10 (IG: tucker_marlo) #BarkWeek https://t.co/kQ04fDDRmh,nan,nan,,https://twitter.com/dog_rates/status/891087950875897856/photo/1,13,10,Franklin,,20243,3136,photo,chesapeake_bay_retriever,0.425595
890971913173991426,nan,nan,2017-07-28 16:27:12,"<a href=""http://twitter.com/download/iphone"" rel=""nofollow"">Twitter for iPhone</a>","Meet Jax. He enjoys ice cream so much he gets nervous around it. 13/10 help Jax enjoy more things by clicking below

https://t.co/Zr4hWfAs1H https://t.co/tVJBRMnhxl",nan,nan,,"https://gofundme.com/ydvmve-surgery-for-jax,https://twitter.com/dog_rates/status/890971913173991426/photo/1",13,10,Jax,,11865,2089,photo,appenzeller,0.34170300000000003
890729181411237888,nan,nan,2017-07-28 00:22:40,"<a href=""http://twitter.com/download/iphone"" rel=""nofollow"">Twitter for iPhone</a>",When you watch your owner call another dog a good boy but then they turn back to you and say you're a great boy. 13/10 https://t.co/v0nONBcwxq,nan,nan,,"https://twitter.com/dog_rates/status/890729181411237888/photo/1,https://twitter.com/dog_rates/status/890729181411237888/photo/1",13,10,Jax,,65612,19059,photo,pomeranian,0.566142
890609185150312448,nan,nan,2017-07-27 16:25:51,"<a href=""http://twitter.com/download/iphone"" rel=""nofollow"">Twitter for iPhone</a>",This is Zoey. She doesn't want to be one of the scary sharks. Just wants to be a snuggly pettable boatpet. 13/10 #BarkWeek https://t.co/9TwLuAGH0b,nan,nan,,https://twitter.com/dog_rates/status/890609185150312448/photo/1,13,10,Zoey,,27790,4300,photo,irish_terrier,0.487574
890240255349198849,nan,nan,2017-07-26 15:59:51,"<a href=""http://twitter.com/download/iphone"" rel=""nofollow"">Twitter for iPhone</a>",This is Cassie. She is a college pup. Studying international doggo communication and stick theory. 14/10 so elegant much sophisticate https://t.co/t1bfwz5S2A,nan,nan,,https://twitter.com/dog_rates/status/890240255349198849/photo/1,14,10,Cassie,doggo,31978,7481,photo,pembroke,0.511319
890006608113172480,nan,nan,2017-07-26 00:31:25,"<a href=""http://twitter.com/download/iphone"" rel=""nofollow"">Twitter for iPhone</a>",This is Koda. He is a South Australian deckshark. Deceptively deadly. Frighteningly majestic. 13/10 would risk a petting #BarkWeek https://t.co/dVPW0B0Mme,nan,nan,,"https://twitter.com/dog_rates/status/890006608113172480/photo/1,https://twitter.com/dog_rates/status/890006608113172480/photo/1",13,10,Koda,,30679,7399,photo,samoyed,0.957979
889880896479866881,nan,nan,2017-07-25 16:11:53,"<a href=""http://twitter.com/download/iphone"" rel=""nofollow"">Twitter for iPhone</a>",This is Bruno. He is a service shark. Only gets out of the water to assist you. 13/10 terrifyingly good boy https://t.co/u1XPQMl29g,nan,nan,,https://twitter.com/dog_rates/status/889880896479866881/photo/1,13,10,Bruno,,27815,5009,photo,french_bulldog,0.377417
889665388333682689,nan,nan,2017-07-25 01:55:32,"<a href=""http://twitter.com/download/iphone"" rel=""nofollow"">Twitter for iPhone</a>",Here's a puppo that seems to be on the fence about something haha no but seriously someone help her. 13/10 https://t.co/BxvuXk0UCm,nan,nan,,https://twitter.com/dog_rates/status/889665388333682689/photo/1,13,10,Bruno,puppo ,48178,10149,photo,pembroke,0.966327
889638837579907072,nan,nan,2017-07-25 00:10:02,"<a href=""http://twitter.com/download/iphone"" rel=""nofollow"">Twitter for iPhone</a>",This is Ted. He does his best. Sometimes that's not enough. But it's ok. 12/10 would assist https://t.co/f8dEDcrKSR,nan,nan,,"https://twitter.com/dog_rates/status/889638837579907072/photo/1,https://twitter.com/dog_rates/status/889638837579907072/photo/1",12,10,Ted,,27200,4583,photo,french_bulldog,0.99165
889531135344209921,nan,nan,2017-07-24 17:02:04,"<a href=""http://twitter.com/download/iphone"" rel=""nofollow"">Twitter for iPhone</a>",This is Stuart. He's sporting his favorite fanny pack. Secretly filled with bones only. 13/10 puppared puppo #BarkWeek https://t.co/y70o6h3isq,nan,nan,,https://twitter.com/dog_rates/status/889531135344209921/photo/1,13,10,Stuart,puppo ,15113,2255,photo,golden_retriever,0.953442
888917238123831296,nan,nan,2017-07-23 00:22:39,"<a href=""http://twitter.com/download/iphone"" rel=""nofollow"">Twitter for iPhone</a>",This is Jim. He found a fren. Taught him how to sit like the good boys. 12/10 for both https://t.co/chxruIOUJN,nan,nan,,https://twitter.com/dog_rates/status/888917238123831296/photo/1,12,10,Jim,,29110,4534,photo,golden_retriever,0.714719
888804989199671297,nan,nan,2017-07-22 16:56:37,"<a href=""http://twitter.com/download/iphone"" rel=""nofollow"">Twitter for iPhone</a>",This is Zeke. He has a new stick. Very proud of it. Would like you to throw it for him without taking it. 13/10 would do my best https://t.co/HTQ77yNQ5K,nan,nan,,"https://twitter.com/dog_rates/status/888804989199671297/photo/1,https://twitter.com/dog_rates/status/888804989199671297/photo/1",13,10,Zeke,,25616,4382,photo,golden_retriever,0.46976
888554962724278272,nan,nan,2017-07-22 00:23:06,"<a href=""http://twitter.com/download/iphone"" rel=""nofollow"">Twitter for iPhone</a>",This is Ralphus. He's powering up. Attempting maximum borkdrive. 13/10 inspirational af https://t.co/YnYAFCTTiK,nan,nan,,"https://twitter.com/dog_rates/status/888554962724278272/photo/1,https://twitter.com/dog_rates/status/888554962724278272/photo/1,https://twitter.com/dog_rates/status/888554962724278272/photo/1,https://twitter.com/dog_rates/status/888554962724278272/photo/1",13,10,Ralphus,,19931,3612,photo,siberian_husky,0.700377
888078434458587136,nan,nan,2017-07-20 16:49:33,"<a href=""http://twitter.com/download/iphone"" rel=""nofollow"">Twitter for iPhone</a>",This is Gerald. He was just told he didn't get the job he interviewed for. A h*ckin injustice. 12/10 didn't want the job anyway https://t.co/DK7iDPfuRX,nan,nan,,"https://twitter.com/dog_rates/status/888078434458587136/photo/1,https://twitter.com/dog_rates/status/888078434458587136/photo/1",12,10,Gerald,,21775,3526,photo,french_bulldog,0.995026
887705289381826560,nan,nan,2017-07-19 16:06:48,"<a href=""http://twitter.com/download/iphone"" rel=""nofollow"">Twitter for iPhone</a>",This is Jeffrey. He has a monopoly on the pool noodles. Currently running a 'boop for two' midweek sale. 13/10 h*ckin strategic https://t.co/PhrUk20Q64,nan,nan,,https://twitter.com/dog_rates/status/887705289381826560/photo/1,13,10,Jeffrey,,30221,5435,photo,basset,0.821664
887473957103951883,nan,nan,2017-07-19 00:47:34,"<a href=""http://twitter.com/download/iphone"" rel=""nofollow"">Twitter for iPhone</a>",This is Canela. She attempted some fancy porch pics. They were unsuccessful. 13/10 someone help her https://t.co/cLyzpcUcMX,nan,nan,,"https://twitter.com/dog_rates/status/887473957103951883/photo/1,https://twitter.com/dog_rates/status/887473957103951883/photo/1",13,10,Canela,,69200,18394,photo,pembroke,0.809197
887101392804085760,nan,nan,2017-07-18 00:07:08,"<a href=""http://twitter.com/download/iphone"" rel=""nofollow"">Twitter for iPhone</a>",This... is a Jubilant Antarctic House Bear. We only rate dogs. Please only send dogs. Thank you... 12/10 would suffocate in floof https://t.co/4Ad1jzJSdp,nan,nan,,https://twitter.com/dog_rates/status/887101392804085760/photo/1,12,10,Canela,,30575,6006,photo,samoyed,0.733942
886983233522544640,nan,nan,2017-07-17 16:17:36,"<a href=""http://twitter.com/download/iphone"" rel=""nofollow"">Twitter for iPhone</a>",This is Maya. She's very shy. Rarely leaves her cup. 13/10 would find her an environment to thrive in https://t.co/I6oNy0CgiT,nan,nan,,"https://twitter.com/dog_rates/status/886983233522544640/photo/1,https://twitter.com/dog_rates/status/886983233522544640/photo/1",13,10,Maya,,35192,7830,photo,chihuahua,0.793469
886736880519319552,nan,nan,2017-07-16 23:58:41,"<a href=""http://twitter.com/download/iphone"" rel=""nofollow"">Twitter for iPhone</a>","This is Mingus. He's a wonderful father to his smol pup. Confirmed 13/10, but he needs your help

https://t.co/bVi0Yr4Cff https://t.co/ISvKOSkd5b",nan,nan,,"https://www.gofundme.com/mingusneedsus,https://twitter.com/dog_rates/status/886736880519319552/photo/1,https://twitter.com/dog_rates/status/886736880519319552/photo/1",13,10,Mingus,,12087,3323,photo,kuvasz,0.309706
886680336477933568,nan,nan,2017-07-16 20:14:00,"<a href=""http://twitter.com/download/iphone"" rel=""nofollow"">Twitter for iPhone</a>",This is Derek. He's late for a dog meeting. 13/10 pet...al to the metal https://t.co/BCoWue0abA,nan,nan,,https://twitter.com/dog_rates/status/886680336477933568/photo/1,13,10,Derek,,22456,4507,photo,,
886366144734445568,nan,nan,2017-07-15 23:25:31,"<a href=""http://twitter.com/download/iphone"" rel=""nofollow"">Twitter for iPhone</a>",This is Roscoe. Another pupper fallen victim to spontaneous tongue ejections. Get the BlepiPen immediate. 12/10 deep breaths Roscoe https://t.co/RGE08MIJox,nan,nan,,"https://twitter.com/dog_rates/status/886366144734445568/photo/1,https://twitter.com/dog_rates/status/886366144734445568/photo/1",12,10,Roscoe,pupper ,21162,3208,photo,french_bulldog,0.999201
886258384151887873,nan,nan,2017-07-15 16:17:19,"<a href=""http://twitter.com/download/iphone"" rel=""nofollow"">Twitter for iPhone</a>",This is Waffles. His doggles are pupside down. Unsure how to fix. 13/10 someone assist Waffles https://t.co/xZDA9Qsq1O,nan,nan,,https://twitter.com/dog_rates/status/886258384151887873/photo/1,13,10,Waffles,,28008,6342,photo,pug,0.943575
885984800019947520,nan,nan,2017-07-14 22:10:11,"<a href=""http://twitter.com/download/iphone"" rel=""nofollow"">Twitter for iPhone</a>",Viewer discretion advised. This is Jimbo. He will rip ur finger right h*ckin off. Other dog clearly an accessory. 12/10 pls pet with caution https://t.co/BuveP0uMF1,nan,nan,,https://twitter.com/dog_rates/status/885984800019947520/photo/1,12,10,Jimbo,,32748,6869,photo,blenheim_spaniel,0.972494
885528943205470208,nan,nan,2017-07-13 15:58:47,"<a href=""http://twitter.com/download/iphone"" rel=""nofollow"">Twitter for iPhone</a>",This is Maisey. She fell asleep mid-excavation. Happens to the best of us. 13/10 would pat noggin approvingly https://t.co/tp1kQ8i9JF,nan,nan,,https://twitter.com/dog_rates/status/885528943205470208/photo/1,13,10,Maisey,,36049,6493,photo,pug,0.369275
885167619883638784,nan,nan,2017-07-12 16:03:00,"<a href=""http://twitter.com/download/iphone"" rel=""nofollow"">Twitter for iPhone</a>",Here we have a corgi undercover as a malamute. Pawbably doing important investigative work. Zero control over tongue happenings. 13/10 https://t.co/44ItaMubBf,nan,nan,,"https://twitter.com/dog_rates/status/885167619883638784/photo/1,https://twitter.com/dog_rates/status/885167619883638784/photo/1,https://twitter.com/dog_rates/status/885167619883638784/photo/1,https://twitter.com/dog_rates/status/885167619883638784/photo/1",13,10,Lilly,,21974,4418,photo,malamute,0.8124819999999999
884925521741709313,nan,nan,2017-07-12 00:01:00,"<a href=""http://twitter.com/download/iphone"" rel=""nofollow"">Twitter for iPhone</a>","This is Earl. He found a hat. Nervous about what you think of it. 12/10 it's delightful, Earl https://t.co/MYJvdlNRVa",nan,nan,,https://twitter.com/dog_rates/status/884925521741709313/photo/1,12,10,Earl,,77649,18608,photo,italian_greyhound,0.259916
884876753390489601,nan,nan,2017-07-11 20:47:12,"<a href=""http://twitter.com/download/iphone"" rel=""nofollow"">Twitter for iPhone</a>",This is Lola. It's her first time outside. Must test the earth and taste the atmosphere. 13/10 you're doing great Lola https://t.co/74TKAUsLkO,nan,nan,,"https://twitter.com/dog_rates/status/884876753390489601/photo/1,https://twitter.com/dog_rates/status/884876753390489601/photo/1,https://twitter.com/dog_rates/status/884876753390489601/photo/1,https://twitter.com/dog_rates/status/884876753390489601/photo/1",13,10,Lola,,27973,5837,photo,chow,0.822103
884562892145688576,nan,nan,2017-07-11 00:00:02,"<a href=""http://twitter.com/download/iphone"" rel=""nofollow"">Twitter for iPhone</a>",This is Kevin. He's just so happy. 13/10 what is your secret Kevin https://t.co/1r4MFCbCX5,nan,nan,,https://twitter.com/dog_rates/status/884562892145688576/photo/1,13,10,Kevin,,24328,4915,photo,pug,0.5464060000000001
884441805382717440,nan,nan,2017-07-10 15:58:53,"<a href=""http://twitter.com/download/iphone"" rel=""nofollow"">Twitter for iPhone</a>","I present to you, Pup in Hat. Pup in Hat is great for all occasions. Extremely versatile. Compact as h*ck. 14/10 (IG: itselizabethgales) https://t.co/vvBOcC2VdC",nan,nan,,https://twitter.com/dog_rates/status/884441805382717440/photo/1,14,10,Kevin,,27020,5700,photo,pembroke,0.993225
884162670584377345,nan,nan,2017-07-09 21:29:42,"<a href=""http://twitter.com/download/iphone"" rel=""nofollow"">Twitter for iPhone</a>",Meet Yogi. He doesn't have any important dog meetings today he just enjoys looking his best at all times. 12/10 for dangerously dapper doggo https://t.co/YSI00BzTBZ,nan,nan,,https://twitter.com/dog_rates/status/884162670584377345/photo/1,12,10,Yogi,doggo,20406,3015,photo,german_shepherd,0.707046
883838122936631299,nan,nan,2017-07-09 00:00:04,"<a href=""http://twitter.com/download/iphone"" rel=""nofollow"">Twitter for iPhone</a>",This is Noah. He can't believe someone made this mess. Got the vacuum out for you though. Offered to help clean pup. 12/10 super good boy https://t.co/V85xujjDDY,nan,nan,,https://twitter.com/dog_rates/status/883838122936631299/photo/1,12,10,Noah,,21923,3478,photo,doberman,0.610946
883482846933004288,nan,nan,2017-07-08 00:28:19,"<a href=""http://twitter.com/download/iphone"" rel=""nofollow"">Twitter for iPhone</a>","This is Bella. She hopes her smile made you smile. If not, she is also offering you her favorite monkey. 13.5/10 https://t.co/qjrljjt948",nan,nan,,"https://twitter.com/dog_rates/status/883482846933004288/photo/1,https://twitter.com/dog_rates/status/883482846933004288/photo/1",3.5,10,Bella,,46015,10047,photo,golden_retriever,0.943082
883360690899218434,nan,nan,2017-07-07 16:22:55,"<a href=""http://twitter.com/download/iphone"" rel=""nofollow"">Twitter for iPhone</a>",Meet Grizzwald. He may be the floofiest floofer I ever did see. Lost eyes saving a schoolbus from a volcano erpuption. 13/10 heroic as h*ck https://t.co/rf661IFEYP,nan,nan,,https://twitter.com/dog_rates/status/883360690899218434/photo/1,13,10,Grizzwald,floofer ,22584,3715,photo,chow,0.987997
883117836046086144,nan,nan,2017-07-07 00:17:54,"<a href=""http://twitter.com/download/iphone"" rel=""nofollow"">Twitter for iPhone</a>","Please only send dogs. We don't rate mechanics, no matter how h*ckin good. Thank you... 13/10 would sneak a pat https://t.co/Se5fZ9wp5E",nan,nan,,"https://twitter.com/dog_rates/status/883117836046086144/photo/1,https://twitter.com/dog_rates/status/883117836046086144/photo/1",13,10,Grizzwald,,37264,6737,photo,golden_retriever,0.949562
882992080364220416,nan,nan,2017-07-06 15:58:11,"<a href=""http://twitter.com/download/iphone"" rel=""nofollow"">Twitter for iPhone</a>",This is Rusty. He wasn't ready for the first pic. Clearly puppared for the second. 13/10 confirmed great boy https://t.co/tyER0KpdXj,nan,nan,,"https://twitter.com/dog_rates/status/882992080364220416/photo/1,https://twitter.com/dog_rates/status/882992080364220416/photo/1",13,10,Rusty,,23975,3959,photo,eskimo_dog,0.466778
882762694511734784,nan,nan,2017-07-06 00:46:41,"<a href=""http://twitter.com/download/iphone"" rel=""nofollow"">Twitter for iPhone</a>",This is Gus. He's quite the cheeky pupper. Already perfected the disinterested wink. 12/10 would let steal my girl https://t.co/D43I96SlVu,nan,nan,,https://twitter.com/dog_rates/status/882762694511734784/photo/1,12,10,Gus,pupper ,28356,4970,photo,labrador_retriever,0.85005
882627270321602560,nan,nan,2017-07-05 15:48:34,"<a href=""http://twitter.com/download/iphone"" rel=""nofollow"">Twitter for iPhone</a>",This is Stanley. He has his first swim lesson today. Doggle straps adjusted. Ready to go. 13/10 Phelps is nervous (IG: stanleythe_corgi) https://t.co/Nx52PGwH94,nan,nan,,https://twitter.com/dog_rates/status/882627270321602560/photo/1,13,10,Stanley,,27923,6152,photo,pembroke,0.542982
882268110199369728,nan,nan,2017-07-04 16:01:23,"<a href=""http://twitter.com/download/iphone"" rel=""nofollow"">Twitter for iPhone</a>",This is Alfy. You're witnessing his first watermelon experience. I think it was a success. 13/10 happy 4th Alfy ðŸ‡ºðŸ‡¸ https://t.co/fYP5RlutfA,nan,nan,,"https://twitter.com/dog_rates/status/882268110199369728/photo/1,https://twitter.com/dog_rates/status/882268110199369728/photo/1,https://twitter.com/dog_rates/status/882268110199369728/photo/1",13,10,Alfy,,45028,11716,photo,golden_retriever,0.762211
882045870035918850,nan,nan,2017-07-04 01:18:17,"<a href=""http://twitter.com/download/iphone"" rel=""nofollow"">Twitter for iPhone</a>","This is Koko. Her owner, inspired by Barney, recently built a cart for her to use during walks if she got tired. 13/10 rest easy Koko https://t.co/zeDpnsKX7w",nan,nan,,"https://twitter.com/dog_rates/status/882045870035918850/photo/1,https://twitter.com/dog_rates/status/882045870035918850/photo/1,https://twitter.com/dog_rates/status/882045870035918850/photo/1,https://twitter.com/dog_rates/status/882045870035918850/photo/1",13,10,Koko,,29407,5038,photo,,
881906580714921986,nan,nan,2017-07-03 16:04:48,"<a href=""http://twitter.com/download/iphone"" rel=""nofollow"">Twitter for iPhone</a>",This is Rey. He's a Benebop Cumberfloof. 12/10 dangerously pettable https://t.co/503CgWbhxQ,nan,nan,,https://twitter.com/dog_rates/status/881906580714921986/photo/1,12,10,Rey,,24331,3423,photo,weimaraner,0.291539
881666595344535552,nan,nan,2017-07-03 00:11:11,"<a href=""http://twitter.com/download/iphone"" rel=""nofollow"">Twitter for iPhone</a>",This is Gary. He couldn't miss this puppertunity for a selfie. Flawless focusing skills. 13/10 would boop intensely https://t.co/7CSWCl8I6s,nan,nan,,https://twitter.com/dog_rates/status/881666595344535552/photo/1,13,10,Gary,,50628,10783,photo,saluki,0.529012
881268444196462592,nan,nan,2017-07-01 21:49:04,"<a href=""http://twitter.com/download/iphone"" rel=""nofollow"">Twitter for iPhone</a>",Meet Elliot. He's a Canadian Forrest Pup. Unusual number of antlers for a dog. Sneaky tongue slip to celebrate #Canada150. 12/10 would pet https://t.co/cgwJwowTMC,nan,nan,,https://twitter.com/dog_rates/status/881268444196462592/photo/1,12,10,Elliot,,23101,5201,photo,,
880935762899988482,nan,nan,2017-06-30 23:47:07,"<a href=""http://twitter.com/download/iphone"" rel=""nofollow"">Twitter for iPhone</a>",This is Louis. He's crossing. It's a big deal. 13/10 h*ckin breathtaking https://t.co/D0wb1GlKAt,nan,nan,,https://twitter.com/dog_rates/status/880935762899988482/photo/1,13,10,Louis,,17026,2805,photo,,
880872448815771648,nan,nan,2017-06-30 19:35:32,"<a href=""http://twitter.com/download/iphone"" rel=""nofollow"">Twitter for iPhone</a>",Ugh not again. We only rate dogs. Please don't send in well-dressed  floppy-tongued street penguins. Dogs only please. Thank you... 12/10 https://t.co/WiAMbTkDPf,nan,nan,,https://twitter.com/dog_rates/status/880872448815771648/photo/1,12,10,Louis,,21328,3859,photo,pembroke,0.791416
880465832366813184,nan,nan,2017-06-29 16:39:47,"<a href=""http://twitter.com/download/iphone"" rel=""nofollow"">Twitter for iPhone</a>",This is Bella. She had her first beach experience this morning. Complete success. 12/10 would perform a sandy boop https://t.co/4VsFysDmiw,nan,nan,,"https://twitter.com/dog_rates/status/880465832366813184/photo/1,https://twitter.com/dog_rates/status/880465832366813184/photo/1,https://twitter.com/dog_rates/status/880465832366813184/photo/1,https://twitter.com/dog_rates/status/880465832366813184/photo/1",12,10,Bella,,28569,6353,photo,golden_retriever,0.913255
880221127280381952,nan,nan,2017-06-29 00:27:25,"<a href=""http://twitter.com/download/iphone"" rel=""nofollow"">Twitter for iPhone</a>",Meet Jesse. He's a Fetty Woof. His tongue ejects without warning. A true bleptomaniac. 12/10 would snug well https://t.co/fUod0tVmvK,nan,nan,,"https://twitter.com/dog_rates/status/880221127280381952/photo/1,https://twitter.com/dog_rates/status/880221127280381952/photo/1",12,10,Jesse,,27116,4277,photo,chihuahua,0.238525
880095782870896641,nan,nan,2017-06-28 16:09:20,"<a href=""http://twitter.com/download/iphone"" rel=""nofollow"">Twitter for iPhone</a>",Please don't send in photos without dogs in them. We're not @porch_rates. Insubordinate and churlish. Pretty good porch tho 11/10 https://t.co/HauE8M3Bu4,nan,nan,,https://twitter.com/dog_rates/status/880095782870896641/photo/1,11,10,Jesse,,27660,4402,photo,miniature_pinscher,0.120298
879862464715927552,nan,nan,2017-06-28 00:42:13,"<a href=""http://twitter.com/download/iphone"" rel=""nofollow"">Twitter for iPhone</a>",This is Romeo. He would like to do an entrance. Requesting your immediate assistance. 13/10 https://t.co/Qh5aEkRQm9,nan,nan,,"https://twitter.com/dog_rates/status/879862464715927552/photo/1,https://twitter.com/dog_rates/status/879862464715927552/photo/1,https://twitter.com/dog_rates/status/879862464715927552/photo/1",13,10,Romeo,,22337,3533,photo,basset,0.813507
879492040517615616,nan,nan,2017-06-27 00:10:17,"<a href=""http://twitter.com/download/iphone"" rel=""nofollow"">Twitter for iPhone</a>",This is Bailey. He thinks you should measure ear length for signs of growth instead. 12/10 https://t.co/IxM9IMKQq8,nan,nan,,https://twitter.com/dog_rates/status/879492040517615616/photo/1,12,10,Bailey,,23435,3220,photo,german_short-haired_pointer,0.479896
879376492567855104,nan,nan,2017-06-26 16:31:08,"<a href=""http://twitter.com/download/iphone"" rel=""nofollow"">Twitter for iPhone</a>",This is Jack AKA Stephen Furry. You're not scoring on him. Unless he slips down the slide. 12/10 would happily get blocked by https://t.co/0gOi601EAa,nan,nan,,https://twitter.com/dog_rates/status/879376492567855104/photo/1,12,10,Jack,,16784,3151,photo,,
879050749262655488,nan,nan,2017-06-25 18:56:45,"<a href=""http://twitter.com/download/iphone"" rel=""nofollow"">Twitter for iPhone</a>",This is Steven. He has trouble relating to other dogs. Quite shy. Neck longer than average. Tropical probably. 11/10 would still pet https://t.co/2mJCDEJWdD,nan,nan,,https://twitter.com/dog_rates/status/879050749262655488/photo/1,11,10,Steven,,22628,4767,photo,,
879008229531029506,nan,nan,2017-06-25 16:07:47,"<a href=""http://twitter.com/download/iphone"" rel=""nofollow"">Twitter for iPhone</a>",This is Beau. That is Beau's balloon. He takes it everywhere. 13/10 would protect at all costs https://t.co/YDtpCjIPKN,nan,nan,,https://twitter.com/dog_rates/status/879008229531029506/photo/1,13,10,Beau,,18995,2723,photo,vizsla,0.960513
878776093423087618,nan,nan,2017-06-25 00:45:22,"<a href=""http://twitter.com/download/iphone"" rel=""nofollow"">Twitter for iPhone</a>",This is Snoopy. He's a proud #PrideMonthPuppo. Impeccable handwriting for not having thumbs. 13/10 would love back #PrideMonth https://t.co/lNZwgNO4gS,nan,nan,,"https://twitter.com/dog_rates/status/878776093423087618/photo/1,https://twitter.com/dog_rates/status/878776093423087618/photo/1",13,10,Snoopy,puppo ,19405,4171,photo,italian_greyhound,0.734684
