tweet_id,in_reply_to_status_id,in_reply_to_user_id,timestamp,source,text,retweeted_status_id,retweeted_status_user_id,retweeted_status_timestamp,expanded_urls,rating_numerator,rating_denominator,name,dog_nick,favorite_count,retweet_count,media_type,dog_breed,dog_breed_conf
680070545539371008,nan,nan,2015-12-24 17:00:27,"<a href=""https://about.twitter.com/products/tweetdeck"" rel=""nofollow"">TweetDeck</a>",Say hello to Emmie. She's trapped in an ornament. Tragic af. Looks pretty content tho. Maybe it's meant to be. 9/10 https://t.co/Fh7geodBCU,nan,nan,,https://twitter.com/dog_rates/status/680070545539371008/photo/1,9,10,Emmie,,2747,962,photo,,
680055455951884288,nan,nan,2015-12-24 16:00:30,"<a href=""https://about.twitter.com/products/tweetdeck"" rel=""nofollow"">TweetDeck</a>","Meet Sammy. At first I was like ""that's a snowflake. we only rate dogs,"" but he would've melted by now, so 10/10 https://t.co/MQfPK4zwuh",nan,nan,,https://twitter.com/dog_rates/status/680055455951884288/photo/1,10,10,Sammy,,17876,7828,photo,samoyed,0.995466
679877062409191424,nan,nan,2015-12-24 04:11:37,"<a href=""http://twitter.com/download/iphone"" rel=""nofollow"">Twitter for iPhone</a>",Meet Penelope. She's a bacon frise. Total babe (lol get it like the movie). Doesn't bark tho. 5/10 very average dog https://t.co/SDcQYg0HSZ,nan,nan,,https://twitter.com/dog_rates/status/679877062409191424/photo/1,5,10,Penelope,,2101,706,photo,,
679862121895714818,nan,nan,2015-12-24 03:12:15,"<a href=""http://twitter.com/download/iphone"" rel=""nofollow"">Twitter for iPhone</a>","""Dammit hooman I'm jus trynna lik the fler"" 11/10 https://t.co/eRZRI8OTj7",nan,nan,,https://twitter.com/dog_rates/status/679862121895714818/photo/1,11,10,Rocco,,2631,684,photo,entlebucher,0.5232060000000001
679854723806179328,nan,nan,2015-12-24 02:42:51,"<a href=""http://twitter.com/download/iphone"" rel=""nofollow"">Twitter for iPhone</a>",This is Bruce. He's a rare pup. Covered in Frosted Flakes. Nifty gold teeth. Overall good dog. 7/10 would pet firmly https://t.co/RtxxACzZ8A,nan,nan,,https://twitter.com/dog_rates/status/679854723806179328/photo/1,7,10,Bruce,,3071,1356,photo,,
679844490799091713,nan,nan,2015-12-24 02:02:12,"<a href=""http://twitter.com/download/iphone"" rel=""nofollow"">Twitter for iPhone</a>",This is Willie. He's floating away and needs your assistance. Please someone help Willie. 10/10 https://t.co/MJqygWqt8X,nan,nan,,https://twitter.com/dog_rates/status/679844490799091713/photo/1,10,10,Willie,,2535,856,photo,airedale,0.903832
679828447187857408,nan,nan,2015-12-24 00:58:27,"<a href=""http://twitter.com/download/iphone"" rel=""nofollow"">Twitter for iPhone</a>",Everybody look at this beautiful pupper 13/10 https://t.co/hyAC5Hq9GC,nan,nan,,"https://twitter.com/dog_rates/status/679828447187857408/photo/1,https://twitter.com/dog_rates/status/679828447187857408/photo/1,https://twitter.com/dog_rates/status/679828447187857408/photo/1",13,10,Willie,pupper ,38793,15392,photo,chihuahua,0.346545
679777920601223168,nan,nan,2015-12-23 21:37:40,"<a href=""http://twitter.com/download/iphone"" rel=""nofollow"">Twitter for iPhone</a>",This is Rinna. She's melting. 10/10 get inside pupper https://t.co/PA0czwucsb,nan,nan,,https://twitter.com/dog_rates/status/679777920601223168/photo/1,10,10,Rinna,pupper ,3300,1233,photo,bloodhound,0.5288189999999999
679736210798047232,nan,nan,2015-12-23 18:51:56,"<a href=""http://twitter.com/download/iphone"" rel=""nofollow"">Twitter for iPhone</a>",This pup's name is Sabertooth (parents must be cool). Ears for days. Jumps unannounced. 9/10 would pet diligently https://t.co/iazoiNUviP,nan,nan,,https://twitter.com/dog_rates/status/679736210798047232/photo/1,9,10,Rinna,,2241,882,photo,french_bulldog,0.319139
679729593985699840,nan,nan,2015-12-23 18:25:38,"<a href=""http://twitter.com/download/iphone"" rel=""nofollow"">Twitter for iPhone</a>",This is Hunter. He was playing with his ball minding his own business. Has no idea what happened to the carpet. 8/10 https://t.co/DbUTDI3u1R,nan,nan,,https://twitter.com/dog_rates/status/679729593985699840/photo/1,8,10,Hunter,,2312,906,photo,,
679722016581222400,nan,nan,2015-12-23 17:55:32,"<a href=""http://twitter.com/download/iphone"" rel=""nofollow"">Twitter for iPhone</a>",This is Mike. He is a Jordanian Frito Pilates. Frowning because he can't see directly in front of him. 8/10 https://t.co/NL5QJwdEpF,nan,nan,,https://twitter.com/dog_rates/status/679722016581222400/photo/1,8,10,Mike,,1770,520,photo,boxer,0.459604
679530280114372609,nan,nan,2015-12-23 05:13:38,"<a href=""http://twitter.com/download/iphone"" rel=""nofollow"">Twitter for iPhone</a>",Guys this really needs to stop. We've been over this way too many times. This is a giraffe. We only rate dogs.. 7/10 https://t.co/yavgkHYPOC,nan,nan,,https://twitter.com/dog_rates/status/679530280114372609/photo/1,7,10,,,5083,2277,photo,dalmatian,0.750256
679527802031484928,nan,nan,2015-12-23 05:03:47,"<a href=""http://twitter.com/download/iphone"" rel=""nofollow"">Twitter for iPhone</a>",This little pupper just arrived. 11/10 would snug https://t.co/DA5aqnSGfB,nan,nan,,https://twitter.com/dog_rates/status/679527802031484928/photo/1,11,10,,pupper ,2832,802,photo,,
679511351870550016,nan,nan,2015-12-23 03:58:25,"<a href=""http://twitter.com/download/iphone"" rel=""nofollow"">Twitter for iPhone</a>",Say hello to William. He makes fun of others because he's terrified of his own deep-seated insecurities. 7/10 https://t.co/bwuV6FlRxr,nan,nan,,https://twitter.com/dog_rates/status/679511351870550016/photo/1,7,10,William,,3605,1414,photo,chihuahua,0.761972
679503373272485890,nan,nan,2015-12-23 03:26:43,"<a href=""http://twitter.com/download/iphone"" rel=""nofollow"">Twitter for iPhone</a>",This is Dwight. He's a pointy pupper. Very docile. Attracts marshmallows. Hurts to pet but definitely worth it 8/10 https://t.co/jjW7zTxY9Z,nan,nan,,https://twitter.com/dog_rates/status/679503373272485890/photo/1,8,10,Dwight,pupper ,3379,1629,photo,,
679475951516934144,nan,nan,2015-12-23 01:37:45,"<a href=""http://twitter.com/download/iphone"" rel=""nofollow"">Twitter for iPhone</a>",This is Evy. She doesn't want to be a Koala. 9/10 https://t.co/VITeF0Kl9L,nan,nan,,https://twitter.com/dog_rates/status/679475951516934144/photo/1,9,10,Evy,,2246,703,photo,maltese_dog,0.145742
679462823135686656,nan,nan,2015-12-23 00:45:35,"<a href=""http://twitter.com/download/iphone"" rel=""nofollow"">Twitter for iPhone</a>",Meet Hurley. He's the curly one. He hugs every other dog he sees during his walk. 11/10 for spreading the love https://t.co/M6vqkt2GKV,nan,nan,,https://twitter.com/dog_rates/status/679462823135686656/photo/1,11,10,Hurley,,34008,20691,photo,toy_poodle,0.62178
679158373988876288,nan,nan,2015-12-22 04:35:49,"<a href=""http://twitter.com/download/iphone"" rel=""nofollow"">Twitter for iPhone</a>",This is Rubio. He has too much skin. 11/10 https://t.co/NLOHmlENag,nan,nan,,https://twitter.com/dog_rates/status/679158373988876288/photo/1,11,10,Rubio,,22989,8913,photo,pug,0.27220500000000003
679148763231985668,nan,nan,2015-12-22 03:57:37,"<a href=""http://twitter.com/download/iphone"" rel=""nofollow"">Twitter for iPhone</a>",I know everyone's excited for Christmas but that doesn't mean you can send in reindeer. We only rate dogs... 8/10 https://t.co/eWjWgbOCYL,nan,nan,,https://twitter.com/dog_rates/status/679148763231985668/photo/1,8,10,Rubio,,2961,1130,photo,italian_greyhound,0.302685
679132435750195208,nan,nan,2015-12-22 02:52:45,"<a href=""http://twitter.com/download/iphone"" rel=""nofollow"">Twitter for iPhone</a>",This is Louis. He's a river dancer. His friends think it's badass. All are very supportive. 10/10 for Louis https://t.co/qoIvjKMY58,nan,nan,,https://twitter.com/dog_rates/status/679132435750195208/photo/1,10,10,Louis,,3169,1274,photo,scottish_deerhound,0.19461
679062614270468097,nan,nan,2015-12-21 22:15:18,"<a href=""http://twitter.com/download/iphone"" rel=""nofollow"">Twitter for iPhone</a>",This is Chompsky. He lives up to his name. 11/10 https://t.co/Xl37lQEWd0,nan,nan,,"https://twitter.com/dog_rates/status/679062614270468097/photo/1,https://twitter.com/dog_rates/status/679062614270468097/photo/1",11,10,Chompsky,,18274,9039,photo,,
679047485189439488,nan,nan,2015-12-21 21:15:11,"<a href=""http://twitter.com/download/iphone"" rel=""nofollow"">Twitter for iPhone</a>",This dog doesn't know how to stairs. Quite tragic really. 9/10 get it together pup https://t.co/kTpr9PTMg1,nan,nan,,https://twitter.com/dog_rates/status/679047485189439488/photo/1,9,10,Chompsky,,2409,751,photo,,
678991772295516161,nan,nan,2015-12-21 17:33:48,"<a href=""http://twitter.com/download/iphone"" rel=""nofollow"">Twitter for iPhone</a>",If your Monday isn't going so well just take a look at this. Both 12/10 https://t.co/GJT6SILPGU,nan,nan,,https://twitter.com/dog_rates/status/678991772295516161/photo/1,12,10,Rascal,,2485,1283,photo,eskimo_dog,0.330216
678969228704284672,nan,nan,2015-12-21 16:04:13,"<a href=""http://twitter.com/download/iphone"" rel=""nofollow"">Twitter for iPhone</a>",Meet Lola. She's a Metamorphic Chartreuse. Plays with her food. Insubordinate and churlish. Exquisite hardwood 11/10 https://t.co/etpBNXwN7f,nan,nan,,https://twitter.com/dog_rates/status/678969228704284672/photo/1,11,10,Lola,,1747,506,photo,labrador_retriever,0.680251
678800283649069056,nan,nan,2015-12-21 04:52:53,"<a href=""http://twitter.com/download/iphone"" rel=""nofollow"">Twitter for iPhone</a>",Here's a pupper with some mean tan lines. Snazzy sweater though 12/10 https://t.co/DpCSVsl6vu,nan,nan,,https://twitter.com/dog_rates/status/678800283649069056/photo/1,12,10,Lola,pupper ,2747,988,photo,labrador_retriever,0.213673
678798276842360832,nan,nan,2015-12-21 04:44:55,"<a href=""http://twitter.com/download/iphone"" rel=""nofollow"">Twitter for iPhone</a>",This is Linda. She fucking hates trees. 7/10 https://t.co/blaY85FIxR,nan,nan,,https://twitter.com/dog_rates/status/678798276842360832/photo/1,7,10,Linda,,3722,1303,photo,airedale,0.583122
678774928607469569,nan,nan,2015-12-21 03:12:08,"<a href=""http://twitter.com/download/iphone"" rel=""nofollow"">Twitter for iPhone</a>",This is Tug. He's not required to wear the cone he just wants his voice to project more clearly. 11/10 https://t.co/Sp739Ou2qx,nan,nan,,https://twitter.com/dog_rates/status/678774928607469569/photo/1,11,10,Tug,,2968,1011,photo,pembroke,0.194681
678767140346941444,nan,nan,2015-12-21 02:41:11,"<a href=""http://twitter.com/download/iphone"" rel=""nofollow"">Twitter for iPhone</a>",This is Mia. She makes awful decisions. 8/10 https://t.co/G6TQVgTcZz,nan,nan,,https://twitter.com/dog_rates/status/678767140346941444/photo/1,8,10,Mia,,3767,1507,photo,,
678764513869611008,nan,nan,2015-12-21 02:30:45,"<a href=""http://twitter.com/download/iphone"" rel=""nofollow"">Twitter for iPhone</a>","Meet Wilson. He got caught humping the futon. He's like ""dude, help me out here"" 10/10 I'd help Wilson out https://t.co/m6XoclB0qv",nan,nan,,https://twitter.com/dog_rates/status/678764513869611008/photo/1,10,10,Wilson,,1740,526,photo,irish_terrier,0.696646
678755239630127104,nan,nan,2015-12-21 01:53:54,"<a href=""http://twitter.com/download/iphone"" rel=""nofollow"">Twitter for iPhone</a>",This is Dash. He didn't think the water would be that cold. Damn it Dash it's December. Think a little. 10/10 https://t.co/NqcOwG8pxW,nan,nan,,https://twitter.com/dog_rates/status/678755239630127104/photo/1,10,10,Dash,,7628,3639,photo,malamute,0.606654
678740035362037760,nan,nan,2015-12-21 00:53:29,"<a href=""http://twitter.com/download/iphone"" rel=""nofollow"">Twitter for iPhone</a>",Meet Tango. He's a large dog. Doesn't care much for personal space. Owner isn't very accepting. Tongue slip. 6/10 https://t.co/p2T5kGebxe,nan,nan,,https://twitter.com/dog_rates/status/678740035362037760/photo/1,6,10,Tango,,3996,1871,photo,,
678675843183484930,nan,nan,2015-12-20 20:38:24,"<a href=""http://twitter.com/download/iphone"" rel=""nofollow"">Twitter for iPhone</a>",Exotic pup here. Tail long af. Throat looks swollen. Might breathe fire. Exceptionally unfluffy 2/10 would still pet https://t.co/a8SqCaSo2r,nan,nan,,https://twitter.com/dog_rates/status/678675843183484930/photo/1,2,10,Tango,,3068,1634,photo,,
678643457146150913,nan,nan,2015-12-20 18:29:43,"<a href=""http://twitter.com/download/iphone"" rel=""nofollow"">Twitter for iPhone</a>",Meet Grizz. He just arrived. Couldn't wait until Christmas. Worried bc he saw the swastikas on the carpet. 10/10 https://t.co/QBGwYrT7rv,nan,nan,,https://twitter.com/dog_rates/status/678643457146150913/photo/1,10,10,Grizz,,2186,468,photo,labrador_retriever,0.33875700000000003
678446151570427904,nan,nan,2015-12-20 05:25:42,"<a href=""http://twitter.com/download/iphone"" rel=""nofollow"">Twitter for iPhone</a>",Touching scene here. Really stirs up the emotions. The bond between father &amp; son. So beautiful. 10/10 for both pups https://t.co/AJWJHov5gx,nan,nan,,https://twitter.com/dog_rates/status/678446151570427904/photo/1,10,10,Grizz,,4261,1727,photo,staffordshire_bullterrier,0.284492
678424312106393600,nan,nan,2015-12-20 03:58:55,"<a href=""http://twitter.com/download/iphone"" rel=""nofollow"">Twitter for iPhone</a>",This is Crystal. She's a shitty fireman. No sense of urgency. People could be dying Crystal. 2/10 just irresponsible https://t.co/rtMtjSl9pz,nan,nan,,https://twitter.com/dog_rates/status/678424312106393600/photo/1,2,10,Crystal,,5776,2788,photo,maltese_dog,0.759945
678410210315247616,nan,nan,2015-12-20 03:02:53,"<a href=""http://twitter.com/download/iphone"" rel=""nofollow"">Twitter for iPhone</a>",Say hello to Jerome. He can shoot french fries out of his mouth at insane speeds. Deadly af. 10/10 https://t.co/dIy88HwrX8,nan,nan,,https://twitter.com/dog_rates/status/678410210315247616/photo/1,10,10,Jerome,,4526,2000,photo,schipperke,0.145877
678396796259975168,nan,nan,2015-12-20 02:09:34,"<a href=""http://twitter.com/download/iphone"" rel=""nofollow"">Twitter for iPhone</a>",These little fellas have opposite facial expressions. Both 12/10 https://t.co/LmThv0GWen,nan,nan,,"https://twitter.com/dog_rates/status/678396796259975168/photo/1,https://twitter.com/dog_rates/status/678396796259975168/photo/1",12,10,Jerome,,1689,459,photo,pembroke,0.95618
678389028614488064,nan,nan,2015-12-20 01:38:42,"<a href=""http://twitter.com/download/iphone"" rel=""nofollow"">Twitter for iPhone</a>","This is Bella. She just learned that her final grade in chem was a 92.49 
poor pupper 11/10 https://t.co/auOoKuoveM",nan,nan,,https://twitter.com/dog_rates/status/678389028614488064/photo/1,2.4,10,Bella,pupper ,1989,459,photo,miniature_pinscher,0.516284
678380236862578688,nan,nan,2015-12-20 01:03:46,"<a href=""http://twitter.com/download/iphone"" rel=""nofollow"">Twitter for iPhone</a>",This is Crumpet. He underestimated the snow. Quickly retreating. 10/10 https://t.co/a0Zx5LDFZa,nan,nan,,https://twitter.com/dog_rates/status/678380236862578688/photo/1,10,10,Crumpet,,2594,988,photo,,
678341075375947776,nan,nan,2015-12-19 22:28:09,"<a href=""http://twitter.com/download/iphone"" rel=""nofollow"">Twitter for iPhone</a>",This pupper likes tape. 12/10 https://t.co/cSp6w5GWgm,nan,nan,,https://twitter.com/dog_rates/status/678341075375947776/photo/1,12,10,Crumpet,pupper ,1840,590,photo,golden_retriever,0.853284
678334497360859136,nan,nan,2015-12-19 22:02:01,"<a href=""http://twitter.com/download/iphone"" rel=""nofollow"">Twitter for iPhone</a>",This is Rosie. She has a snazzy bow tie and a fin for a tail. Probably super fast underwater. Cool socks 10/10 https://t.co/GO76MdGBs0,nan,nan,,https://twitter.com/dog_rates/status/678334497360859136/photo/1,10,10,Rosie,,1382,292,photo,norfolk_terrier,0.378643
678278586130948096,nan,nan,2015-12-19 18:19:51,"<a href=""http://twitter.com/download/iphone"" rel=""nofollow"">Twitter for iPhone</a>",Another spooky pupper here. Most definitely floating. No legs. Probably knows some dark magic. 10/10 very spooked https://t.co/JK8MByRzgj,nan,nan,,https://twitter.com/dog_rates/status/678278586130948096/photo/1,10,10,Rosie,pupper ,12238,6645,photo,maltese_dog,0.897841
678255464182861824,nan,nan,2015-12-19 16:47:58,"<a href=""http://twitter.com/download/iphone"" rel=""nofollow"">Twitter for iPhone</a>",This is Jessifer. She is a Bismoth Teriyaki. Flowers being attacked by hurricanes on bandana (rad). 9/10 stellar pup https://t.co/nZhmRwZzWv,nan,nan,,https://twitter.com/dog_rates/status/678255464182861824/photo/1,9,10,Jessifer,,1687,407,photo,chihuahua,0.613819
678021115718029313,nan,nan,2015-12-19 01:16:45,"<a href=""http://twitter.com/download/iphone"" rel=""nofollow"">Twitter for iPhone</a>",This is Reese. He likes holding hands. 12/10 https://t.co/cbLroGCbmh,nan,nan,,https://twitter.com/dog_rates/status/678021115718029313/photo/1,12,10,Reese,,14654,6957,photo,miniature_pinscher,0.822048
677918531514703872,nan,nan,2015-12-18 18:29:07,"<a href=""http://twitter.com/download/iphone"" rel=""nofollow"">Twitter for iPhone</a>","""Everything looks pretty good in there. Make sure to brush your gums. Been flossing? How's school going?"" Both 10/10 https://t.co/lWL2IMJqLR",nan,nan,,https://twitter.com/dog_rates/status/677918531514703872/photo/1,10,10,Izzy,,1435,445,photo,eskimo_dog,0.199347
677895101218201600,nan,nan,2015-12-18 16:56:01,"<a href=""http://twitter.com/download/iphone"" rel=""nofollow"">Twitter for iPhone</a>",Guys this was terrifying. Really spooked me up. We don't rate ghosts. We rate dogs. Please only send dogs... 9/10 https://t.co/EJImi1udYb,nan,nan,,https://twitter.com/dog_rates/status/677895101218201600/photo/1,9,10,Izzy,,5146,2315,photo,dalmatian,0.550702
677716515794329600,nan,nan,2015-12-18 05:06:23,"<a href=""http://twitter.com/download/iphone"" rel=""nofollow"">Twitter for iPhone</a>",IT'S PUPPERGEDDON. Total of 144/120 ...I think https://t.co/ZanVtAtvIq,nan,nan,,https://twitter.com/dog_rates/status/677716515794329600/photo/1,144,120,Izzy,,3244,1066,photo,,
677700003327029250,nan,nan,2015-12-18 04:00:46,"<a href=""http://twitter.com/download/iphone"" rel=""nofollow"">Twitter for iPhone</a>",This is Ralph. He's an interpretive dancer. 10/10 https://t.co/zoDdPyPFsa,nan,nan,,https://twitter.com/dog_rates/status/677700003327029250/photo/1,10,10,Ralph,,3600,1567,photo,siberian_husky,0.120849
677698403548192770,nan,nan,2015-12-18 03:54:25,"<a href=""http://twitter.com/download/iphone"" rel=""nofollow"">Twitter for iPhone</a>",This is Sadie. She got her holidays confused. 9/10 damn it Sadie https://t.co/fm7HxOsuPK,nan,nan,,https://twitter.com/dog_rates/status/677698403548192770/photo/1,9,10,Sadie,,1298,348,photo,shih-tzu,0.916645
677687604918272002,nan,nan,2015-12-18 03:11:30,"<a href=""http://twitter.com/download/iphone"" rel=""nofollow"">Twitter for iPhone</a>",This was Cindy's face when she heard Susan forgot the snacks for after the kid's soccer game. 11/10 https://t.co/gzkuVGRgAD,nan,nan,,https://twitter.com/dog_rates/status/677687604918272002/photo/1,11,10,Sadie,,2627,918,photo,pembroke,0.573047
677673981332312066,nan,nan,2015-12-18 02:17:22,"<a href=""http://twitter.com/download/iphone"" rel=""nofollow"">Twitter for iPhone</a>",Endangered triangular pup here. Could be a wizard. Caught mid-laugh. No legs. Just fluff. Probably a wizard. 9/10 https://t.co/GFVIHIod0Z,nan,nan,,https://twitter.com/dog_rates/status/677673981332312066/photo/1,9,10,Sadie,,3545,1632,photo,maltese_dog,0.817908
677662372920729601,nan,nan,2015-12-18 01:31:14,"<a href=""http://twitter.com/download/iphone"" rel=""nofollow"">Twitter for iPhone</a>","In honor of the new Star Wars movie. Here's Yoda pug. 12/10 pet really well, would I https://t.co/pvjdRn00XH",nan,nan,,https://twitter.com/dog_rates/status/677662372920729601/photo/1,12,10,Sadie,,2078,1064,photo,,
677573743309385728,nan,nan,2015-12-17 19:39:03,"<a href=""http://twitter.com/download/iphone"" rel=""nofollow"">Twitter for iPhone</a>",This is Sandy. He's sexually confused. Thinks he's a pigeon. Also an All-American cheese catcher. 10/10 so petable https://t.co/Htu8plSqEu,nan,nan,,"https://twitter.com/dog_rates/status/677573743309385728/photo/1,https://twitter.com/dog_rates/status/677573743309385728/photo/1",10,10,Sandy,,2272,798,photo,,
677565715327688705,nan,nan,2015-12-17 19:07:09,"<a href=""http://twitter.com/download/iphone"" rel=""nofollow"">Twitter for iPhone</a>",Contortionist pup here. Inside pentagram. Clearly worships Satan. Known to slowly push fragile stuff off tables 6/10 https://t.co/EX9oR55VMe,nan,nan,,https://twitter.com/dog_rates/status/677565715327688705/photo/1,6,10,Sandy,,1369,499,photo,basset,0.397295
677557565589463040,nan,nan,2015-12-17 18:34:46,"<a href=""http://twitter.com/download/iphone"" rel=""nofollow"">Twitter for iPhone</a>",Reckless pupper here. Not even looking at road. Absolute menace. No regard for fellow pupper lives. 10/10 still cute https://t.co/96IBkOYB7j,nan,nan,,https://twitter.com/dog_rates/status/677557565589463040/photo/1,10,10,Sandy,pupper ,2590,1271,photo,,
677547928504967168,nan,nan,2015-12-17 17:56:29,"<a href=""http://twitter.com/download/iphone"" rel=""nofollow"">Twitter for iPhone</a>",Not much to say here. I just think everyone needs to see this. 12/10 https://t.co/AGag0hFHpe,nan,nan,,https://twitter.com/dog_rates/status/677547928504967168/photo/1,12,10,Sandy,,7370,3960,photo,american_staffordshire_terrier,0.914978
677530072887205888,nan,nan,2015-12-17 16:45:31,"<a href=""http://twitter.com/download/iphone"" rel=""nofollow"">Twitter for iPhone</a>",Say hello to Axel. He's a Black Chevy Pinot on wheels. 0 to 60 in 5.7 seconds (if downhill). 9/10 I call shotgun https://t.co/DKe9DBnnHE,nan,nan,,https://twitter.com/dog_rates/status/677530072887205888/photo/1,5.7,10,Axel,,1130,244,photo,staffordshire_bullterrier,0.6892590000000001
677334615166730240,nan,nan,2015-12-17 03:48:51,"<a href=""http://twitter.com/download/iphone"" rel=""nofollow"">Twitter for iPhone</a>",This dog gave up mid jump. 9/10 https://t.co/KmMv3Y2zI8,nan,nan,,"https://twitter.com/dog_rates/status/677334615166730240/photo/1,https://twitter.com/dog_rates/status/677334615166730240/photo/1",9,10,Axel,,1438,320,photo,lakeland_terrier,0.859392
677331501395156992,nan,nan,2015-12-17 03:36:28,"<a href=""http://twitter.com/download/iphone"" rel=""nofollow"">Twitter for iPhone</a>",Meet Humphrey. He's a Northern Polyp Viagra. One ear works. Face stuck like that. Always surprised. 9/10 petable af https://t.co/FS7eJQM2F4,nan,nan,,https://twitter.com/dog_rates/status/677331501395156992/photo/1,9,10,Humphrey,,1157,258,photo,beagle,0.313464
677328882937298944,nan,nan,2015-12-17 03:26:04,"<a href=""http://twitter.com/download/iphone"" rel=""nofollow"">Twitter for iPhone</a>",This is Derek. All the dogs adore Derek. He's a great guy. 10/10 really solid pup https://t.co/KgcsGNb61s,nan,nan,,https://twitter.com/dog_rates/status/677328882937298944/photo/1,10,10,Derek,,3856,1633,photo,,
677314812125323265,nan,nan,2015-12-17 02:30:09,"<a href=""http://twitter.com/download/iphone"" rel=""nofollow"">Twitter for iPhone</a>","Meet Tassy &amp; Bee. Tassy is pretty chill, but Bee is convinced the Ruffles are haunted. 10/10 &amp; 11/10 respectively https://t.co/fgORpmTN9C",nan,nan,,"https://twitter.com/dog_rates/status/677314812125323265/photo/1,https://twitter.com/dog_rates/status/677314812125323265/photo/1",10,10,Tassy,,1749,586,photo,blenheim_spaniel,0.924127
677301033169788928,nan,nan,2015-12-17 01:35:24,"<a href=""http://twitter.com/download/iphone"" rel=""nofollow"">Twitter for iPhone</a>",This is Juckson. He's totally on his way to a nascar race. 5/10 for Juckson https://t.co/IoLRvF0Kak,nan,nan,,https://twitter.com/dog_rates/status/677301033169788928/photo/1,5,10,Juckson,,1321,451,photo,japanese_spaniel,0.6611779999999999
677269281705472000,nan,nan,2015-12-16 23:29:14,"<a href=""http://twitter.com/download/iphone"" rel=""nofollow"">Twitter for iPhone</a>",This is the happiest pupper I've ever seen. 10/10 would trade lives with https://t.co/ep8ATEJwRb,nan,nan,,https://twitter.com/dog_rates/status/677269281705472000/photo/1,10,10,,pupper ,2106,767,photo,shetland_sheepdog,0.656616
677228873407442944,nan,nan,2015-12-16 20:48:40,"<a href=""http://twitter.com/download/iphone"" rel=""nofollow"">Twitter for iPhone</a>",Say hello to Chuq. He just wants to fit in. 11/10 https://t.co/hGkMCjZzn4,nan,nan,,https://twitter.com/dog_rates/status/677228873407442944/photo/1,11,10,Chuq,,3754,1783,photo,,
677187300187611136,nan,nan,2015-12-16 18:03:28,"<a href=""http://twitter.com/download/iphone"" rel=""nofollow"">Twitter for iPhone</a>",Here we see a Byzantine Rigatoni. Very aerodynamic. No eyes. Actually not windy here they just look like that. 9/10 https://t.co/gzI0m6wXRo,nan,nan,,https://twitter.com/dog_rates/status/677187300187611136/photo/1,9,10,Chuq,,2900,1000,photo,english_setter,0.282396
676975532580409345,nan,nan,2015-12-16 04:01:59,"<a href=""http://twitter.com/download/iphone"" rel=""nofollow"">Twitter for iPhone</a>",This is Cooper. He doesn't know how cheese works. Likes the way it feels on his face. Cheeky tongue slip. 11/10 https://t.co/j1zczS0lI5,nan,nan,,https://twitter.com/dog_rates/status/676975532580409345/photo/1,11,10,Cooper,,2940,1168,photo,malamute,0.363257
676949632774234114,nan,nan,2015-12-16 02:19:04,"<a href=""http://twitter.com/download/iphone"" rel=""nofollow"">Twitter for iPhone</a>",This is Tyrus. He's a Speckled Centennial Ticonderoga. Terrified of floating red ball. Nifty bandana. 8/10 v petable https://t.co/HqM3YhCaaa,nan,nan,,https://twitter.com/dog_rates/status/676949632774234114/photo/1,8,10,Tyrus,,1373,428,photo,welsh_springer_spaniel,0.206479
